{
  "$schema": "https://json-schema.org/draft/2020-12/schema",
  "$id": "base-hackathon/labels.v0.schema.json",
  "title": "Labels v0: hand-worked truth for one site",
  "description": "What a person worked out for a site, independent of any criteria path. Truth values follow PR #4: pass and fail are outside the labeller's own uncertainty; borderline means the truth itself sits within its uncertainty of a threshold (a correct path says unsure); unknown means the labeller could not settle it (not scored).",
  "type": "object",
  "additionalProperties": false,
  "required": ["format", "site", "data", "labeller", "method", "labels"],
  "properties": {
    "format": {"const": "base-labels/v0"},
    "site": {"type": "string"},
    "data": {"enum": ["real", "synthetic", "hybrid"]},
    "labeller": {"type": "string"},
    "method": {"type": "string"},
    "rules_profile": {"type": "string"},
    "site_decision": {"enum": ["pass", "manual_review", "reject", "unknown"], "description": "The placement decision a correct path must reach for the whole site."},
    "labels": {
      "type": "array",
      "items": {
        "type": "object",
        "additionalProperties": false,
        "required": ["id", "criterion", "scope", "truth", "why"],
        "properties": {
          "id": {"type": "string"},
          "criterion": {"type": "string", "description": "Criterion id, or 'placement' for a start range's overall outcome (worst of all placement checks)."},
          "scope": {"enum": ["site", "start_range"]},
          "wall_id": {"type": "string"},
          "start_s_m": {"type": "array", "minItems": 2, "maxItems": 2, "items": {"type": "number"}, "description": "Battery left-edge positions this label covers (scene s, meters)."},
          "truth": {"enum": ["pass", "fail", "borderline", "not_pass", "unknown"], "description": "not_pass: the labeller can say it must not pass (fail or unsure both acceptable), as in PR #13's outcome_not."},
          "value_ft": {"type": "number"},
          "plus_minus_ft": {"type": "number", "minimum": 0},
          "why": {"type": "string"}
        }
      }
    }
  }
}
