{
 "format": "base-labels/v0",
 "site": "eth3d-delivery",
 "data": "hybrid",
 "labeller": "Track C criteria worker (draft, for Hunter's approval)",
 "method": "Hand review of frames against internal/criteria/SSR_Prompts.md; exported from internal/criteria/house-labels.json by export_labels_v0.py. Site-scope labels plus start_range labels where a scene with a meter exists.",
 "rules_profile": "S",
 "site_decision": "reject",
 "labels": [
  {
   "id": "eth3d-delivery.S.meter_number",
   "criterion": "meter_number",
   "scope": "site",
   "truth": "borderline",
   "why": "[high] No confirmed electric meter; empty string only if no electric meter number is photographed. Evidence: none."
  },
  {
   "id": "eth3d-delivery.S.cl320",
   "criterion": "cl320",
   "scope": "site",
   "truth": "borderline",
   "why": "[high] truth: not_applicable; expected: {\"cl320Label\": \"cl320_unclear\", \"hasCl320Meter\": false, \"insufficientEvidence\": true} Evidence: none."
  },
  {
   "id": "eth3d-delivery.S.oversized_can",
   "criterion": "oversized_can",
   "scope": "site",
   "truth": "borderline",
   "why": "[high] truth: not_applicable; expected: {\"meterCanLabel\": \"meter_can_unclear\", \"hasLargeOrOversizedMeterCan\": false, \"insufficientEvidence\": true} Evidence: none."
  },
  {
   "id": "eth3d-delivery.S.meter_type",
   "criterion": "meter_type",
   "scope": "site",
   "truth": "borderline",
   "why": "[high] No usable view: all four y-coordinates and distance_ratio = 0. Evidence: none."
  },
  {
   "id": "eth3d-delivery.S.meter_mount",
   "criterion": "meter_mount",
   "scope": "site",
   "truth": "borderline",
   "why": "[medium] truth: not_applicable; expected: {\"type\": \"unknown\", \"clean-decision\": false} Evidence: none."
  },
  {
   "id": "eth3d-delivery.S.meter_not_accessible",
   "criterion": "meter_not_accessible",
   "scope": "site",
   "truth": "borderline",
   "why": "[high] Meter invented (w1, s=0, 1.5 m up), so there's no photo of it. The synthetic AC sits 0.97-1.77 m straight out and 0-0.8 m to the right: about 6 cm outside the 3 ft x 2.5 ft envelope, so review ('can't tell whether inside the envelope'). Evidence: scene internal/eval-harness/results/eth3d-delivery/gt-laser/scene.json, equipment internal/breadth/c2-volumetric/scenes/eth3d-delivery-garage.json, photos internal/breadth/c2-volumetric/results/viz/delivery_area_photos.jpg, plan internal/breadth/c2-volumetric/results/viz/c2_delivery_demo.png."
  },
  {
   "id": "eth3d-delivery.S.multiple_mains",
   "criterion": "multiple_mains",
   "scope": "site",
   "truth": "borderline",
   "why": "[high] No panel photographed. Evidence: none."
  },
  {
   "id": "eth3d-delivery.S.main_panel_type",
   "criterion": "main_panel_type",
   "scope": "site",
   "truth": "borderline",
   "why": "[high] truth: not_applicable; expected: \"manual_review\" Evidence: none."
  },
  {
   "id": "eth3d-delivery.S.meter_panel_relationship",
   "criterion": "meter_panel_relationship",
   "scope": "site",
   "truth": "borderline",
   "why": "[high] truth: not_applicable; expected: {\"meterPanelRelationship\": \"insufficient_evidence\", \"mainPanelLocation\": \"not_visible\", \"evidenceSufficiency\": \"insufficient\"} Evidence: none."
  },
  {
   "id": "eth3d-delivery.S.panel_not_accessible",
   "criterion": "panel_not_accessible",
   "scope": "site",
   "truth": "borderline",
   "why": "[high] truth: not_applicable; expected: \"manual_review\" Evidence: none."
  },
  {
   "id": "eth3d-delivery.S.panel_in_house",
   "criterion": "panel_in_house",
   "scope": "site",
   "truth": "borderline",
   "why": "[high] truth: not_applicable; expected: \"manual_review\" Evidence: none."
  },
  {
   "id": "eth3d-delivery.S.not_same_wall",
   "criterion": "not_same_wall",
   "scope": "site",
   "truth": "borderline",
   "why": "[high] truth: not_applicable; expected: \"manual_review\" Evidence: none."
  },
  {
   "id": "eth3d-delivery.S.panel_recall",
   "criterion": "panel_recall",
   "scope": "site",
   "truth": "borderline",
   "why": "[high] truth: not_applicable; expected: \"manual_review\" Evidence: none."
  },
  {
   "id": "eth3d-delivery.S.placement",
   "criterion": "placement",
   "scope": "site",
   "truth": "not_pass",
   "why": "[medium] Indoor underground loading garage. The concrete floor is continuous and vans and a car are parked on it, so every battery spot is on a drivable surface: 0 ft < 3 ft (C) / 5 ft (A/B). The scene's ground region says 'concrete', not drive, so geometry paths that trust region material will miss this. Left of the meter, the 8.4 m sliding garage door (w1, s -9.30 to -0.90) is a hard route break and an opening. Right of it, the corner is at s 0.86, then back wall w2 is observed well past the 26 ft (7.92 m) cable reach. On w2: a synthetic AC at s ~1.8-2.6, facing gaps of 0.3-0.7 m at s 3.0-7.3 and 9.7-10.6, a mesh storage cage 8 cm in front of the wall at s 7.3-13.8, and low overheads (1.27-1.83 m) at s 4.5-7.6 and 9.7-10.6. S-reject = C-reject. Evidence: scene internal/eval-harness/results/eth3d-delivery/gt-laser/scene.json, equipment internal/breadth/c2-volumetric/scenes/eth3d-delivery-garage.json, photos internal/breadth/c2-volumetric/results/viz/delivery_area_photos.jpg, plan internal/breadth/c2-volumetric/results/viz/c2_delivery_demo.png."
  },
  {
   "id": "eth3d-delivery.S.placement.w1.0",
   "scope": "start_range",
   "criterion": "placement",
   "wall_id": "w1",
   "start_s_m": [
    -9.3002,
    0.8598
   ],
   "truth": "fail",
   "why": "Every battery position on w1 stands on the drivable garage floor and is indoors; left of s -0.90 is the garage door itself."
  },
  {
   "id": "eth3d-delivery.S.drive_clearance.w1.1",
   "scope": "start_range",
   "criterion": "drive_clearance",
   "wall_id": "w1",
   "start_s_m": [
    -9.3002,
    0.8598
   ],
   "truth": "fail",
   "why": "The battery sits on the continuous concrete garage floor that vans and a car are parked on (delivery_area photos). It's connected to the drive path, so drive distance = 0 ft.",
   "value_ft": 0.0,
   "plus_minus_ft": 0.0
  },
  {
   "id": "eth3d-delivery.S.placement.w2.2",
   "scope": "start_range",
   "criterion": "placement",
   "wall_id": "w2",
   "start_s_m": [
    0.8598,
    19.2798
   ],
   "truth": "fail",
   "why": "Every battery position on w2 stands on the drivable garage floor and is indoors (w2 beyond 7.92 m is also out of cable reach)."
  },
  {
   "id": "eth3d-delivery.S.drive_clearance.w2.3",
   "scope": "start_range",
   "criterion": "drive_clearance",
   "wall_id": "w2",
   "start_s_m": [
    0.8598,
    19.2798
   ],
   "truth": "fail",
   "why": "The battery sits on the continuous concrete garage floor that vans and a car are parked on (delivery_area photos). It's connected to the drive path, so drive distance = 0 ft.",
   "value_ft": 0.0,
   "plus_minus_ft": 0.0
  }
 ]
}