{
 "format": "base-labels/v0",
 "site": "eth3d-facade",
 "data": "real",
 "labeller": "Track C criteria worker (draft, for Hunter's approval)",
 "method": "Hand review of frames against internal/criteria/SSR_Prompts.md; exported from internal/criteria/house-labels.json by export_labels_v0.py. Site-scope labels plus start_range labels where a scene with a meter exists.",
 "rules_profile": "B",
 "site_decision": "manual_review",
 "labels": [
  {
   "id": "eth3d-facade.B.meter_number",
   "criterion": "meter_number",
   "scope": "site",
   "truth": "borderline",
   "why": "[high] No confirmed electric meter; empty string only if no electric meter number is photographed. Evidence: none."
  },
  {
   "id": "eth3d-facade.B.cl320",
   "criterion": "cl320",
   "scope": "site",
   "truth": "borderline",
   "why": "[high] truth: not_applicable; expected: {\"cl320Label\": \"cl320_unclear\", \"hasCl320Meter\": false, \"insufficientEvidence\": true} Evidence: none."
  },
  {
   "id": "eth3d-facade.B.oversized_can",
   "criterion": "oversized_can",
   "scope": "site",
   "truth": "borderline",
   "why": "[high] truth: not_applicable; expected: {\"meterCanLabel\": \"meter_can_unclear\", \"hasLargeOrOversizedMeterCan\": false, \"insufficientEvidence\": true} Evidence: none."
  },
  {
   "id": "eth3d-facade.B.meter_type",
   "criterion": "meter_type",
   "scope": "site",
   "truth": "borderline",
   "why": "[high] No usable view: all four y-coordinates and distance_ratio = 0. Evidence: none."
  },
  {
   "id": "eth3d-facade.B.meter_mount",
   "criterion": "meter_mount",
   "scope": "site",
   "truth": "borderline",
   "why": "[medium] truth: not_applicable; expected: {\"type\": \"unknown\", \"clean-decision\": false} Evidence: none."
  },
  {
   "id": "eth3d-facade.B.meter_not_accessible",
   "criterion": "meter_not_accessible",
   "scope": "site",
   "truth": "borderline",
   "why": "[high] No real meter; PR #13 invented one. Evidence: none."
  },
  {
   "id": "eth3d-facade.B.multiple_mains",
   "criterion": "multiple_mains",
   "scope": "site",
   "truth": "borderline",
   "why": "[high] No panel photographed. Evidence: none."
  },
  {
   "id": "eth3d-facade.B.main_panel_type",
   "criterion": "main_panel_type",
   "scope": "site",
   "truth": "borderline",
   "why": "[high] truth: not_applicable; expected: \"manual_review\" Evidence: none."
  },
  {
   "id": "eth3d-facade.B.meter_panel_relationship",
   "criterion": "meter_panel_relationship",
   "scope": "site",
   "truth": "borderline",
   "why": "[high] truth: not_applicable; expected: {\"meterPanelRelationship\": \"insufficient_evidence\", \"mainPanelLocation\": \"not_visible\", \"evidenceSufficiency\": \"insufficient\"} Evidence: none."
  },
  {
   "id": "eth3d-facade.B.panel_not_accessible",
   "criterion": "panel_not_accessible",
   "scope": "site",
   "truth": "borderline",
   "why": "[high] truth: not_applicable; expected: \"manual_review\" Evidence: none."
  },
  {
   "id": "eth3d-facade.B.panel_in_house",
   "criterion": "panel_in_house",
   "scope": "site",
   "truth": "borderline",
   "why": "[high] truth: not_applicable; expected: \"manual_review\" Evidence: none."
  },
  {
   "id": "eth3d-facade.B.not_same_wall",
   "criterion": "not_same_wall",
   "scope": "site",
   "truth": "borderline",
   "why": "[high] truth: not_applicable; expected: \"manual_review\" Evidence: none."
  },
  {
   "id": "eth3d-facade.B.panel_recall",
   "criterion": "panel_recall",
   "scope": "site",
   "truth": "borderline",
   "why": "[high] truth: not_applicable; expected: \"manual_review\" Evidence: none."
  },
  {
   "id": "eth3d-facade.B.placement",
   "criterion": "placement",
   "scope": "site",
   "truth": "borderline",
   "why": "[high] No w1 gap reaches 8 ft between openings; wall w2 now has an arched ground-floor window. v0.5 recheck with the laser-read arched ground-floor window on w2 (u 1-6.5 ft, sill 3.5 ft; C1 rules-3d, harness GT 18:25 UTC): w2 has no valid B spot either: 3 ft past the window leaves u 9.5-11.6 ft, 2.1 ft for a 2 ft battery flush against the outside corner (marginal; can't stick out past the corner). B cannot reject, so still manual_review. The C3 GPT-5.5 B pass that placed the battery on w2 is now clearly wrong. Evidence: DSC_0419, DSC_0420, DSC_0362, DSC_0366, DSC_0386, DSC_0414, DSC_0391, DSC_0393."
  }
 ]
}