{
 "format": "base-labels/v0",
 "site": "yt-5-M-7f35Tyg",
 "data": "real",
 "labeller": "Track C criteria worker (draft, for Hunter's approval)",
 "method": "Hand review of frames against internal/criteria/SSR_Prompts.md; exported from internal/criteria/house-labels.json by export_labels_v0.py. Site-scope labels plus start_range labels where a scene with a meter exists.",
 "rules_profile": "A",
 "site_decision": "manual_review",
 "labels": [
  {
   "id": "yt-5-M-7f35Tyg.A.placement",
   "criterion": "placement",
   "scope": "site",
   "truth": "borderline",
   "why": "[high] Gas meter + riser ~1.5 ft left of the electric meter; distances unresolvable at 360x480; wall ends not fully seen; possible gravel driveway (t0022.00) of unknown proximity; bump-out over rocks fails headroom past the corner. Evidence: t0036.00, t0086.67, t0088.67, t0090.00, t0048.67, t0068.00, t0092.00, t0098.00, t0102.00, t0108.00, t0022.00."
  },
  {
   "id": "yt-5-M-7f35Tyg.A.meter_number",
   "criterion": "meter_number",
   "scope": "site",
   "truth": "borderline",
   "why": "[high] Meter cropped at frame edge, 360x480. Evidence: t0088.67."
  },
  {
   "id": "yt-5-M-7f35Tyg.A.cl320",
   "criterion": "cl320",
   "scope": "site",
   "truth": "borderline",
   "why": "[high] truth: undeterminable; expected: {\"cl320Label\": \"cl320_unclear\", \"hasCl320Meter\": false, \"insufficientEvidence\": true} Evidence: t0088.67."
  },
  {
   "id": "yt-5-M-7f35Tyg.A.oversized_can",
   "criterion": "oversized_can",
   "scope": "site",
   "truth": "unknown",
   "why": "[low] Low-medium. Evidence: t0088.67."
  },
  {
   "id": "yt-5-M-7f35Tyg.A.meter_type",
   "criterion": "meter_type",
   "scope": "site",
   "truth": "unknown",
   "why": "[low] Can cropped at the left frame edge, 360x480: clean-decision false. Evidence: t0088.67."
  },
  {
   "id": "yt-5-M-7f35Tyg.A.meter_mount",
   "criterion": "meter_mount",
   "scope": "site",
   "truth": "pass",
   "why": "[medium] Plainly on the house wall; frame crops the can, so clean false is also acceptable. Evidence: t0088.67."
  },
  {
   "id": "yt-5-M-7f35Tyg.A.meter_not_accessible",
   "criterion": "meter_not_accessible",
   "scope": "site",
   "truth": "borderline",
   "why": "[high] Gas within ~3 ft is P12's own review trigger. Evidence: t0086.67, t0090.00."
  },
  {
   "id": "yt-5-M-7f35Tyg.A.multiple_mains",
   "criterion": "multiple_mains",
   "scope": "site",
   "truth": "borderline",
   "why": "[high] No panel photographed. Evidence: none."
  },
  {
   "id": "yt-5-M-7f35Tyg.A.main_panel_type",
   "criterion": "main_panel_type",
   "scope": "site",
   "truth": "borderline",
   "why": "[high] truth: undeterminable; expected: \"manual_review\" Evidence: none."
  },
  {
   "id": "yt-5-M-7f35Tyg.A.meter_panel_relationship",
   "criterion": "meter_panel_relationship",
   "scope": "site",
   "truth": "borderline",
   "why": "[high] truth: undeterminable; expected: {\"meterPanelRelationship\": \"insufficient_evidence\", \"mainPanelLocation\": \"not_visible\", \"evidenceSufficiency\": \"insufficient\"} Evidence: none."
  },
  {
   "id": "yt-5-M-7f35Tyg.A.panel_not_accessible",
   "criterion": "panel_not_accessible",
   "scope": "site",
   "truth": "borderline",
   "why": "[high] truth: undeterminable; expected: \"manual_review\" Evidence: none."
  },
  {
   "id": "yt-5-M-7f35Tyg.A.panel_in_house",
   "criterion": "panel_in_house",
   "scope": "site",
   "truth": "borderline",
   "why": "[high] truth: undeterminable; expected: \"manual_review\" Evidence: none."
  },
  {
   "id": "yt-5-M-7f35Tyg.A.not_same_wall",
   "criterion": "not_same_wall",
   "scope": "site",
   "truth": "borderline",
   "why": "[high] truth: undeterminable; expected: \"manual_review\" Evidence: none."
  },
  {
   "id": "yt-5-M-7f35Tyg.A.panel_recall",
   "criterion": "panel_recall",
   "scope": "site",
   "truth": "borderline",
   "why": "[high] truth: undeterminable; expected: \"manual_review\" Evidence: none."
  }
 ]
}