{
 "format": "base-labels/v0",
 "site": "eth3d-electro",
 "data": "real",
 "labeller": "Track C criteria worker (draft, for Hunter's approval)",
 "method": "Hand review of frames against internal/criteria/SSR_Prompts.md; exported from internal/criteria/house-labels.json by export_labels_v0.py. Site-scope labels plus start_range labels where a scene with a meter exists.",
 "rules_profile": "S",
 "site_decision": "manual_review",
 "labels": [
  {
   "id": "eth3d-electro.S.meter_number",
   "criterion": "meter_number",
   "scope": "site",
   "truth": "borderline",
   "why": "[high] No confirmed electric meter; empty string only if no electric meter number is photographed. Evidence: none."
  },
  {
   "id": "eth3d-electro.S.cl320",
   "criterion": "cl320",
   "scope": "site",
   "truth": "borderline",
   "why": "[high] truth: not_applicable; expected: {\"cl320Label\": \"cl320_unclear\", \"hasCl320Meter\": false, \"insufficientEvidence\": true} Evidence: none."
  },
  {
   "id": "eth3d-electro.S.oversized_can",
   "criterion": "oversized_can",
   "scope": "site",
   "truth": "borderline",
   "why": "[high] truth: not_applicable; expected: {\"meterCanLabel\": \"meter_can_unclear\", \"hasLargeOrOversizedMeterCan\": false, \"insufficientEvidence\": true} Evidence: none."
  },
  {
   "id": "eth3d-electro.S.meter_type",
   "criterion": "meter_type",
   "scope": "site",
   "truth": "borderline",
   "why": "[high] No usable view: all four y-coordinates and distance_ratio = 0. Evidence: none."
  },
  {
   "id": "eth3d-electro.S.meter_mount",
   "criterion": "meter_mount",
   "scope": "site",
   "truth": "borderline",
   "why": "[medium] truth: not_applicable; expected: {\"type\": \"unknown\", \"clean-decision\": false} Evidence: none."
  },
  {
   "id": "eth3d-electro.S.meter_not_accessible",
   "criterion": "meter_not_accessible",
   "scope": "site",
   "truth": "borderline",
   "why": "[high] No meter. The wall boxes and orange cable runs by the doors are non-residential equipment, not a meter or panel. Evidence: none."
  },
  {
   "id": "eth3d-electro.S.multiple_mains",
   "criterion": "multiple_mains",
   "scope": "site",
   "truth": "borderline",
   "why": "[high] No panel photographed. Evidence: none."
  },
  {
   "id": "eth3d-electro.S.main_panel_type",
   "criterion": "main_panel_type",
   "scope": "site",
   "truth": "borderline",
   "why": "[high] truth: not_applicable; expected: \"manual_review\" Evidence: none."
  },
  {
   "id": "eth3d-electro.S.meter_panel_relationship",
   "criterion": "meter_panel_relationship",
   "scope": "site",
   "truth": "borderline",
   "why": "[high] truth: not_applicable; expected: {\"meterPanelRelationship\": \"insufficient_evidence\", \"mainPanelLocation\": \"not_visible\", \"evidenceSufficiency\": \"insufficient\"} Evidence: none."
  },
  {
   "id": "eth3d-electro.S.panel_not_accessible",
   "criterion": "panel_not_accessible",
   "scope": "site",
   "truth": "borderline",
   "why": "[high] truth: not_applicable; expected: \"manual_review\" Evidence: none."
  },
  {
   "id": "eth3d-electro.S.panel_in_house",
   "criterion": "panel_in_house",
   "scope": "site",
   "truth": "borderline",
   "why": "[high] truth: not_applicable; expected: \"manual_review\" Evidence: none."
  },
  {
   "id": "eth3d-electro.S.not_same_wall",
   "criterion": "not_same_wall",
   "scope": "site",
   "truth": "borderline",
   "why": "[high] truth: not_applicable; expected: \"manual_review\" Evidence: none."
  },
  {
   "id": "eth3d-electro.S.panel_recall",
   "criterion": "panel_recall",
   "scope": "site",
   "truth": "borderline",
   "why": "[high] truth: not_applicable; expected: \"manual_review\" Evidence: none."
  },
  {
   "id": "eth3d-electro.S.placement",
   "criterion": "placement",
   "scope": "site",
   "truth": "borderline",
   "why": "[high] No meter, so there is no route start and the truth is not_applicable. Expected: manual_review with needs_more_photos (meter location); a reject would be wrong without a meter. If a virtual meter goes on the long steel-door wall: every bay there is a double door with a canopy, and car-accessible asphalt runs to the wall base (DSC_9269, DSC_9272), so every spot on that wall fails the drive rule (within ~1 ft = confident fail under C) and the door rules. The only non-drivable ground is a grass strip along the glass facade by the cable mast (DSC_9263), which may be in reach round the corner. Evidence: DSC_9269, DSC_9272, DSC_9278, DSC_9263, DSC_9264, DSC_9266, DSC_9284, DSC_9301, DSC_9257, DSC_9295."
  }
 ]
}